{
  "$schema": "https://json-schema.org/draft/2020-12/schema",
  "$id": "https://marketlistener.local/contracts/bar.schema.json",
  "title": "Normalized market bar",
  "type": "object",
  "additionalProperties": false,
  "required": ["schema_version", "instrument_key", "period", "trading_day", "bar_open_time", "bar_close_time", "timezone", "open", "high", "low", "close", "volume", "amount", "open_interest", "price_mode", "source", "source_period", "quality_status"],
  "properties": {
    "schema_version": {"const": 1},
    "instrument_key": {"$ref": "#/$defs/instrumentKey"},
    "period": {"enum": ["1m", "5m", "15m", "30m", "1h", "2h", "4h", "1d", "1w", "1mo"]},
    "trading_day": {"type": "string", "format": "date", "pattern": "^[0-9]{4}-[0-9]{2}-[0-9]{2}$"},
    "bar_open_time": {"type": "string", "format": "date-time", "pattern": "^[0-9]{4}-[0-9]{2}-[0-9]{2}T[0-9]{2}:[0-9]{2}:[0-9]{2}(Z|[+-][0-9]{2}:[0-9]{2})$"},
    "bar_close_time": {"type": "string", "format": "date-time", "pattern": "^[0-9]{4}-[0-9]{2}-[0-9]{2}T[0-9]{2}:[0-9]{2}:[0-9]{2}(Z|[+-][0-9]{2}:[0-9]{2})$"},
    "timezone": {"type": "string", "pattern": "^[A-Za-z_]+/[A-Za-z_]+(?:/[A-Za-z_]+)*$"},
    "open": {"type": "number", "exclusiveMinimum": 0},
    "high": {"type": "number", "exclusiveMinimum": 0},
    "low": {"type": "number", "exclusiveMinimum": 0},
    "close": {"type": "number", "exclusiveMinimum": 0},
    "pct_change": {"type": ["number", "null"], "description": "close 相对前一根 bar close 的涨跌幅，派生字段"},
    "amplitude": {"type": ["number", "null"], "description": "(high-low)/前一根 close，派生字段"},
    "currency": {"type": "string", "pattern": "^[A-Z]{3}$", "description": "计价货币，例如 CNY/HKD/USD"},
    "volume": {"type": "number", "minimum": 0},
    "amount": {"type": "number", "minimum": 0},
    "open_interest": {"type": ["number", "null"], "minimum": 0},
    "price_mode": {"enum": ["RAW", "FORWARD_ADJUSTED", "BACKWARD_ADJUSTED"]},
    "source": {
      "type": "object",
      "additionalProperties": false,
      "required": ["provider", "source_symbol", "retrieved_at"],
      "properties": {
        "provider": {"type": "string", "minLength": 1},
        "source_symbol": {"type": "string", "minLength": 1},
        "retrieved_at": {"type": "string", "format": "date-time"}
      }
    },
    "source_period": {"type": "string", "minLength": 1},
    "quality_status": {"enum": ["PASS", "WARNING", "FAILED"]}
  },
  "$defs": {
    "instrumentKey": {
      "type": "object",
      "additionalProperties": false,
      "required": ["country_or_market", "exchange", "asset_type", "code"],
      "properties": {
        "country_or_market": {"type": "string", "pattern": "^[A-Z]{2,12}$"},
        "exchange": {"type": "string", "pattern": "^[A-Z0-9_-]{2,16}$"},
        "asset_type": {"enum": ["STOCK", "INDEX", "FUTURE", "OPTION", "FUND", "ETF", "BOND", "COMMODITY", "CRYPTO"]},
        "code": {"type": "string", "pattern": "^[A-Z0-9._-]+$"}
      }
    }
  }
}
